{
  "cargo_lock_sha256": "9667dfe7306dffefb156a13155a683d3c0289030a0cfe0660ca0b5be322c54f1",
  "cargo_version": "cargo 1.98.0 (797e8a9bc 2026-08-05)",
  "deterministic_environment": {
    "CARGO_INCREMENTAL": "0",
    "LC_ALL": "C",
    "MACOSX_DEPLOYMENT_TARGET": "15.0",
    "SOURCE_DATE_EPOCH": "0",
    "TZ": "UTC",
    "ZERO_AR_DATE": "1"
  },
  "features": "all",
  "linker_determinism": "-Wl,-no_uuid",
  "locked": true,
  "path_remapping": {
    "cargo_home": "/cargo",
    "repository": "/workspace/mainframe-env",
    "rustup_home": "/rustup"
  },
  "profile": "release",
  "profile_settings": {
    "codegen_units": 1,
    "debug": 0,
    "incremental": false,
    "strip": "symbols"
  },
  "rustc_verbose": "rustc 1.98.0 (88d9e12ae 2026-08-18)\nbinary: rustc\ncommit-hash: 88d9e12ae178fab0fb5cc050a94da85685d449ea\ncommit-date: 2026-08-18\nrelease: 1.98.0\nLLVM version: 22.1.8",
  "schema_version": "mainframe-env.release-build-inputs@1",
  "source_digest": "sha256:905ab74be195244083bf49f8aa0dab53ad2265cd2b9d3b9afbe12ec064ba2b57",
  "target": "aarch64-apple-darwin"
}
