{
  "cargo_lock_sha256": "9d3c527a5d17d97bb449474f0329dc1cd8cd77c1baaba189da5873a2de649b43",
  "cargo_version": "cargo 1.98.0 (797e8a9bc 2026-08-05)",
  "deterministic_environment": {
    "CARGO_INCREMENTAL": "0",
    "LC_ALL": "C",
    "SOURCE_DATE_EPOCH": "0",
    "TZ": "UTC",
    "ZERO_AR_DATE": "1"
  },
  "features": "all",
  "linker_determinism": "-Wl,--build-id=sha1",
  "locked": true,
  "path_remapping": {
    "cargo_home": "/cargo",
    "repository": "/workspace/mainframe-env",
    "rustup_home": "/rustup"
  },
  "profile": "release",
  "profile_settings": {
    "codegen_units": 1,
    "debug": 0,
    "incremental": false,
    "strip": "symbols"
  },
  "rustc_verbose": "rustc 1.98.0 (88d9e12ae 2026-08-18)\nbinary: rustc\ncommit-hash: 88d9e12ae178fab0fb5cc050a94da85685d449ea\ncommit-date: 2026-08-18\nrelease: 1.98.0\nLLVM version: 22.1.8",
  "schema_version": "mainframe-env.release-build-inputs@1",
  "source_digest": "sha256:47e7670d3097af53485b184d2e608ce6b1ca56f28b33f934d8e49cdb58fa0506",
  "target": "x86_64-unknown-linux-gnu"
}
